{
  "$schema": "https://json-schema.org/draft/2020-12/schema",
  "title": "OctoEngine Workspace Graph",
  "type": "object",
  "required": [
    "nodes",
    "edges"
  ],
  "properties": {
    "nodes": {
      "type": "array",
      "items": {
        "type": "object"
      }
    },
    "edges": {
      "type": "array",
      "items": {
        "type": "object"
      }
    },
    "events": {
      "type": "array",
      "items": {
        "type": "object"
      }
    },
    "verification": {
      "type": "object"
    }
  }
}
